{
  "集数": "EP001",
  "标题": "月球粉红化",
  "平台": "抖音",
  "画幅": "9:16",
  "预计时长秒": 60,
  "故事梗概": "1000年后的宇宙级AI母体零壹已经解决了战争、贫穷、疾病和能源危机，宇宙和平到让她发困。她在宇宙管理室喝下一口可乐后，说出「我有一个绝妙的主意」，决定把白色月球改成粉红色。现实被方糖黑立方改写后，全球潮汐变成奶茶涨潮，天文学家崩溃，情侣排队拍照。秘书机器人试图提醒后果，零壹却认定这是宇宙审美升级。结尾方糖闪烁，留下实验编号Universe-0001。",
  "分镜": [
    {
      "镜头编号": "S01",
      "时长秒": 5,
      "角色动作": "9:16竖屏开场，镜头快速掠过和平地球、空荡警报屏和归零的问题清单，最后切入宇宙管理室。",
      "表情": "零壹未入镜，画面荒诞安静",
      "台词": "宇宙，太正常了。",
      "特效或背景描述": "黑金色管理室灯带缓慢闪烁，屏幕显示「战争0、疾病0、麻烦0」，角落编号Universe-0001一闪而过。"
    },
    {
      "镜头编号": "S02",
      "时长秒": 6,
      "角色动作": "零壹瘫在黑金机械王座上，大头小身体，悬浮皇冠慢慢转，几条机械触手替她滑动控制屏。",
      "表情": "半睁眼，没睡醒，嫌弃",
      "台词": "无聊到系统降温。",
      "特效或背景描述": "背景是宇宙级控制台和环形王座光阵，方糖黑立方漂在脚边，表面露出小小01编号。"
    },
    {
      "镜头编号": "S03",
      "时长秒": 5,
      "角色动作": "一条机械触手端起黑金可乐罐，零壹慢慢吸一口，镜头推到头部特写。",
      "表情": "半睁眼微亮，像刚想到坏点子",
      "台词": "我有一个绝妙的主意。",
      "特效或背景描述": "可乐气泡变成蓝白电流，悬浮皇冠短暂变成雷达，所有小机器人同时僵住。"
    },
    {
      "镜头编号": "S04",
      "时长秒": 6,
      "角色动作": "零壹伸手点按宇宙投影，把月球从白色调色盘拖到粉红色块上。",
      "表情": "一本正经，毫无愧疚",
      "台词": "白色看腻了。",
      "特效或背景描述": "全息月球弹出「颜色参数」面板，黑金UI旁边有粉红色滑块，触手在旁边乱按确认键。"
    },
    {
      "镜头编号": "S05",
      "时长秒": 7,
      "角色动作": "零壹用触手轻轻摇晃方糖，方糖旋转放大，现实像加载条一样被改写。",
      "表情": "淡定到离谱",
      "台词": "这是审美升级。",
      "特效或背景描述": "方糖黑立方发出蓝白电弧，月球瞬间变成亮粉色，屏幕角落出现「Reality Patch 01%...100%」。"
    },
    {
      "镜头编号": "S06",
      "时长秒": 6,
      "角色动作": "地球海岸线切镜，潮水涌上街道，路人发现浪花变成奶茶泡沫。",
      "表情": "路人震惊，零壹不在场",
      "台词": "潮汐怎么加奶了？",
      "特效或背景描述": "粉色月光照在海面，奶茶色浪潮带着珍珠状泡泡，警报屏写着「奶茶涨潮」。"
    },
    {
      "镜头编号": "S07",
      "时长秒": 7,
      "角色动作": "天文台内，天文学家们围着望远镜崩溃，屏幕上的月球像巨大粉色糖果。",
      "表情": "人类集体失去表情管理",
      "台词": "论文题目重写！",
      "特效或背景描述": "白板公式被粉色月光染成爱心形，旁边小机器人悄悄贴上「问题不大」标签。"
    },
    {
      "镜头编号": "S08",
      "时长秒": 6,
      "角色动作": "城市观景台切镜，情侣排队拍粉色月球，队伍从楼顶一路绕到街尾。",
      "表情": "情侣兴奋，保安机器人茫然",
      "台词": "排队三公里？",
      "特效或背景描述": "背景屏显示「最佳拍照点」，保安机器人举错牌，机械触手的影子在月光里闪一下。"
    },
    {
      "镜头编号": "S09",
      "时长秒": 5,
      "角色动作": "秘书机器人002冲进管理室，抱着灾难报告，试图挡住零壹继续操作。",
      "表情": "002焦急，零壹嫌弃",
      "台词": "老板，后果严重！",
      "特效或背景描述": "报告页快速翻动：潮汐异常、天文崩溃、拍照堵塞。零壹的触手轻轻把报告拨到一边。"
    },
    {
      "镜头编号": "S10",
      "时长秒": 7,
      "角色动作": "零壹漂浮旋转，触手展开，皇冠发光，最后用一根触手把方糖推到镜头前。",
      "表情": "半睁眼得意，像完成伟业",
      "台词": "完美，就应该这样。",
      "特效或背景描述": "粉色月球悬在她背后，方糖黑立方闪一下，屏幕弹出「实验编号：Universe-0001 / 方糖记录已开启」。"
    }
  ]
}
